id,type,text1,text2,text3,text4,notes
planet_killa,CUSTOM," 이 달에는 아직도 전쟁의 상처가 남아있습니다. 주요 대도시 중심부의 돔은 찢겨져 열렸고, 여전히 방사 패턴으로 흩어진 파편의 분출물이 단단한 진공 상태에 드러났습니다.",,"눈에 띄지 않는 지형에서 얻은 모호한 IR 판독값은 표토 아래 위장된 거주지를 암시합니다. 킬라 내부에는 확실히 생존자들이 숨어 있지만, 어떤 조직화된 정치체도 더 큰 섹터와 개방적인 관계를 유지하지 않습니다. 그리고 부랑자 화물선의 찌그러진 선체가 어떤 징후라도 보인다면 지역 주민들은 별로 환영받지 못합니다.",,
planet_viscacha,CUSTOM,두꺼운 독성 대기를 지닌 외계에서 포획된 이 달은 빠른 궤도와 남반구의 재미있는 모양의 분지 때문에 이름이 붙여졌습니다.,,,,
planet_qaras,CUSTOM,붕괴 후 Eridani-Utopia Corporation의 고립된 요소가 내부 인프라와 비축물을 사용하여 추운 세계가 테라포밍되어 거주 가능합니다. Qaras의 매력은 Hanan Pacha가 2차 AI 전쟁 중에 충격적으로 파괴될 때까지 Hanan Pacha의 광채와 결코 일치하지 않았습니다.,,"초기 식민지 시대 동안 Qaras는 Eridani-Utopia가 운영하는 주요 휘발성 물질/유기물 처리 센터였습니다. 2차 AI 전쟁 이후 전체 시스템은 비무장화를 선언했고, 카라스는 황폐화를 피하는 동안 용병과 도적의 동맹에 의해 즉시 점령당했습니다. 아직까지는 헤게모니가 탈환 노력을 기울일 가치가 없었습니다.",,
planet_donn,CUSTOM,섹터의 초기 로봇 탐사선들이 재빠르게 알아낸 외로운 고대 세계는 히브라실 성계에서 형성된 것이 아니라 약 수억 년 전에 히브라실에 의해 포착되었습니다. Donn은 쉽게 접근할 수 있는 중금속 농도로 인해 관심도가 낮거나 중간 정도인 것으로 표시되었습니다.,,때때로 투자자를 안심시키기 위한 힘을 과시하기 위해 Tri-Tachyon 순찰대에 의해 폭격을 받음에도 불구하고 Donn은 Tri-Tachyon이 전쟁 시에 요구하고 평화 시에 폐기하는 피비린내 나는 용병들을 위한 이상적인 모집 또는 투기장임이 입증되었습니다.,,
planet_balar,CUSTOM,"발라르는 대부분 물, 암모니아, 메탄으로 구성된 얼음 거인입니다. 얼음 구름으로 뒤덮인 소용돌이는 거의 평온하지만 남극 상공에는 단 한 번의 거대한 암흑 폭풍이 발생합니다. 이 변칙적인 현상을 조사하기 위한 노력은 거의 이루어지지 않았습니다.",,,,
planet_cethlenn,CUSTOM,"암모니아 강, 수빙 고원, 메탄 빙하로 이루어진 얼어붙은 세계입니다. 발라르의 자기장에 갇힌 전하 입자는 세스렌의 얇은 대기에 환상적인 오로라를 만들어냅니다. 계절에 따라 사용되는 유기물 추출 장비는 불규칙한 암석 곶의 독특한 호 위에 세워진 도시인 Cethlenn의 유일한 영구 정착지에서 제공됩니다.",,"트라이-타키온의 영향력은 이 명목상 독립된 정치체에서 명백합니다. 애드 홀로스와 TT 제품은 어디에나 있습니다. Persean 부문 상거래 협정에서 불법으로 간주되는 ""약정""을 통해 지역 비즈니스 및 산업을 통해 세탁된 크레딧도 마찬가지입니다.",,
planet_ena,CUSTOM,형제 위성들 사이에서 이상하게 밀도가 높고 바위가 많은 Ena의 표면은 조수 압력으로 가열된 수많은 간헐천에서 분출되는 얼어붙은 가스의 흔적으로 가득 차 있습니다. 얇지만 눈에 보이는 대기는 발라의 강력한 자기권에 갇힌 하전 입자의 토러스를 공급합니다.,,,,
planet_crom_cruach,CUSTOM,이 세계는 황량하고 눈에 띄지 않지만 경제적 가치가 거의 없는 특이한 황 화합물이 널리 퍼져 있습니다. Hybrasil 시스템의 식민지화 기간 동안 광산은 Culann의 배고픈 용광로를 위한 광석을 추출하기 위한 광범위한 작업을 결합했습니다. 그러나 붕괴로 인해 Crom Cruach의 시민 행정은 정치적으로나 문자 그대로의 전투에서 내부 시스템으로의 가장 좋은 점프 포인트 근처에 있는 이 전략적 지점에 영향력을 행사하기 위해 붕괴되었습니다.,,,,
planet_culann,CUSTOM,유명한 쿨란 광산 중 가장 오래된 광산은 붕괴 직후 의심스럽게도 내부 히브라실 성계 전체와 인근 성계에 전력을 투사하는 주요 트라이-타키온 군사 기지로 전환되었습니다. 가장 깊은 무기고에는 이해할 수 없는 AI-현현에 의해 밝혀진 신비한 기술을 기반으로 한 멋진 무기가 포함되어 있다고 합니다. 하지만 두 번의 전쟁 이후 헤게모니 조사관은 아직 이러한 소문을 확인하기 위해 내부에 발을 들여놓지 않았습니다.,,첨단 기술의 함선 갠트리 열차가 마치 자손 떼처럼 Culann Starforge를 따라 Culann 위의 빛나는 호를 그리며 행진합니다. 행성은 무겁게 벙커되어 있고 대함선 배터리가 배치되어 있습니다. Tri-Tachyon 마케팅은 표면 아래에 있고 궤도에 매달려 있는 무서운 무기의 잠재력을 암시하는 수용 베이와 갤러리에 비즈니스 친화적인 환영 이미지를 투사합니다.,,
station_culann,CUSTOM,"Culann Starforge는 수백 년 전 Hybrasil 근처의 주요 에너지를 효율적으로 활용할 수 있는 독창적인 에너지 변환 및 저장 기술 포트폴리오에 강점을 둔 기업에 의해 무중력 제련 및 야금의 주요 중심지로 설립되었습니다. 이 회사와 그 자산, 그리고 Culann 자체는 전통적으로 에너지 변환, 발전 및 투사 산업을 지배해 온 Tri-Tachyon Corporation에 의해 빠르게 인수되었습니다.",,상업용 리셉션 라운지의 홀로스는 Tri-Tachyon이 설계하고 제조한 무기 시스템의 잘못된 끝으로 인해 발생하는 반짝이고 응집력이 떨어지는 제품을 유쾌하게 전시합니다. 방문하는 우주선 선장에게는 다과가 무료로 제공됩니다. 곧 끈질긴 판매원에게서 배우게 됩니다.,,
planet_eochu_bres,CUSTOM,페르세우스 섹터의 식민지 시대 말기에 테라포밍된 Eochu Bres는 격렬하고 빠르게 변화하는 날씨로 인해 막 찢겨진 봉우리와 피요르드의 세계입니다. 붕괴 직전에 완성된 궤도 거울 배열에도 불구하고 여전히 테란 최적보다 더 차갑습니다.,,"빛나는 트라이-타키온(Tri-Tachyon) 회사 생태학은 판자촌 지역의 난폭하게 뻗어나가는 것 위로 우뚝 솟아 있습니다. 트라이-타키온 샐러리아트는 높은 도시 제나두(Xanadu)에서 보안 드론의 보호를 받으며 태어나고 살다가 죽는 반면, 절박한 계약직 노동자 계층은 법을 포함하여 회사 돈으로 무엇이든 사고 팔 수 있는 낮은 도시에 거주합니다. 최고로 군림합니다.",,
inactive_gate,CUSTOM,"아다만틴 재질의 조용한 반지로, 버려진 옛 시대의 것입니다.",,,,
active_gate,CUSTOM,"아다만틴 재질의 조용한 반지입니다. 보는 방법을 안다면 이제 감지할 수 있습니다. 센서는 더 높은 차원에서 오는 희미한 진동을 감지할 수 있습니다.
 
 그것은 거의 들리지 않는 노래, 열리기를 기다리는 문과 같습니다.",,,,
station_tigra_city,CUSTOM,티그라 링(Tigra Ring)에 채굴 작업이 설립된 것은 인간이 이 구역에 도착한 직후였습니다. 연속적인 추출의 물결은 Tigra Station의 운영을 감독할 수 있는 권한을 부여받은 거대 군단의 순환을 통해 광부 파업과 반란을 보였습니다.,,"최초의 광부들의 후손들은 회전하는 저중력 우주 농장과 고갈된 광체의 수리장, 현재 정거장 고리에 내장된 오래된 탐사 장비로 눈을 돌렸습니다. 주민들은 조상들의 반항적 태도를 유지하고 있지만, 지역 주민과 해군 승무원 사이에 벌어지는 싸움은 일반적으로 이념적 저항보다는 술 취한 자세의 결과입니다.",,
planet_typhon,CUSTOM,"주로 수소와 헬륨으로 구성된 크게 눈에 띄지 않는 거대 가스입니다. 수십 년 전, 행성이 위상 기술과 유사한 특성을 사용하는 외계생명체 가족의 숙주라고 주장하는 과학자 '내부고발자'에 대한 사소한 스캔들이 터졌습니다. 과학자는 Eventide의 치료 시설에 투입되었으며 저궤도에 대한 권한은 전적으로 헤게모니 군사 행정부에 넘겨졌습니다.",,,,
planet_sphinx,CUSTOM,페르세안 구역의 초기 식민지화 기간 동안 도메인 함대 물류 센터로 설립된 소규모 AM 연료 생산 시설은 지역 반란이 발생할 경우 도메인 함대에 중단 없이 연료를 공급하기 위해 스핑크스 표면 깊은 곳에 건설되었습니다. 헤게모니는 이러한 전략적 전망을 계승했습니다.,,교통 통제는 엄격하며 들어오는 모든 함선에는 대함 포대에 의해 태그가 지정되고 추적됩니다. 군사화는 민간 기반 시설까지 확대됩니다. 검문소 시설은 현재는 운영되지 않지만 그럼에도 불구하고 주요 통로와 환승 허브에 배치되어 있습니다.,,
planet_orthrus,CUSTOM,"질소 눈으로 뒤덮인 메탄 빙하로 덮인 표면에서 물얼음 산이 분출됩니다. 소수의 불규칙한 규산염 고원은 채굴 기회가 좋지 않습니다. 결코 번영하는 세상이 아니었지만, 오르트로스의 추출 산업 전체는 헤게모니 공간 밖의 계약을 통해 여러 세대에 걸쳐 지원을 받아왔습니다.",,"외부 투자자의 지원을 받는 소규모 가족 회사 협의회에 의해 통치되는 헤게모니 피닉스는 Orthrus를 불타는 날개 아래 보호하는 것이 적합하지 않다고 생각했습니다. 자원 보유량이 너무 부족하고, 전략적 가치가 군사화된 스핑크스의 달에 의해 가려졌으며, 독립 세계에 대한 헤게모니의 존중을 상징하는 정치 체제가 완전히 통합되기에는 너무 유용했습니다.",,
station_chupi_orco,CUSTOM,"한때 Chupi Orco의 자기권을 조작하여 인공 폭풍 시스템의 가장 높은 곳에서 휘발성 물질을 우주로 끌어당겼던 거대한 산업 기계였던 코일, 발전기 및 탱크는 이제 파괴되었으며 서식지는 에너지 창으로 관통됩니다. 몇몇 격납고와 접근 터널은 여전히 최소한의 생명 유지 기능을 보여주고 있으며, 피할 수 없는 가스 누출과 태양 전지 오염으로 인해 역이 무덤처럼 차갑고 죽은 상태로 남을 때까지 불쌍하게도 남아 있습니다.",,,,
lava_minor,PLANET,"영구적으로 형성된 지각이 없는 지질학적으로 불안정한 행성입니다. 빛나는 균열과 활화산이 표면을 뒤덮고, 이들이 뿜어내는 마그마가 결합하여 그을린 표면을 가로질러 수백 킬로미터를 이동하는 흐름을 형성합니다.",,,,
planet_ithaca,CUSTOM,자기장이 거의 없는 오래되고 건조한 세계임에도 불구하고 이타카는 Eridani-Utopia Terraforming Corporation에 의해 좋은 후보로 판단되었습니다. 수십억 년 동안 조용했던 페넬로페의 별은 이타카와 그 형제 행성인 오기기아의 변화를 촉진하는 활동의 중심지가 되었지만 붕괴로 인해 완전한 혼란에 빠졌습니다.,,"표면을 스캔한 결과 행성학 연구실, 지질 조사 현장 및 몇 개의 노천 광산으로 추정되는 임시 배치 장소가 몇 군데 드러났습니다. 작은 로봇 기상 관측소는 때때로 미약하고 쓸모없는 무선 신호를 보냅니다. 먼지폭풍으로 인해 장비가 쓸모없게 변질되었습니다.",,
planet_ogygia,CUSTOM,표면에 정말 재앙적이고 상대적으로 최근에 발생한 충격 사건의 흔적이 남아 있는 작고 황량한 세계인 오기기아는 그럼에도 불구하고 형제 행성인 이타카를 위해 시스템 전반에 걸친 인프라가 구축되어 있기 때문에 가치 있는 2차 테라포밍 후보로 간주되었습니다. Collapse는 이러한 계획을 종식시켰습니다.,,대규모 충격으로 인해 오기기아(Ogygia) 반구 전체의 상당 부분이 평균 고도보다 수십 킬로미터 아래로 가라앉은 차가운 용암 바다가 되었습니다. 벗겨진 기초와 이상하게도 균열 바닥에 있는 뜨겁게 달궈진 Onslaught급 전함 선체의 절반을 제외하고는 인간의 방문 흔적이 거의 남아 있지 않습니다.,,
station_telepylus,CUSTOM,"모듈식 격납고, 산업용 포드, 거주지 링이 있는 숲 아래 묻혀 있는 오래된 확장 시대 포자선의 핵심 주위에 건설된 광대한 궤도 정거장입니다. 이 정거장은 한때 소행성 입찰자와 외부 시스템을 트롤링하는 이동식 정유소의 집결지였습니다. 이제 완전히 죽었습니다.",,"1차 원자로와 모든 귀중한 산업 구성요소는 신속하게 제거되었으며, 광범위한 2차 피해로 판단됩니다. 수동 백업 시스템은 프로세스에 의해 손상되었으며 스테이션은 생명 유지를 유지하기에 충분한 에너지를 받기에는 기본 스테이션에서 너무 멀리 떨어져 있었습니다. 항법 컴퓨터의 작은 경고 신호는 정거장의 궤도가 쇠퇴하고 있으며 500주기 이내에 텔레필루스 대기에서 불타버릴 것임을 알려줍니다.
 정거장에 도킹하는 것은 바람직하지 않습니다.",,
planet_ismara,CUSTOM,세계의 차가운 얼음 공인 이스마라는 페넬로페 별의 지구 세계를 육성하기 위해 내부 시스템을 향해 그래핀으로 둘러싸인 메가톤급의 물과 질소 패키지 석판을 발사하기 위한 광산과 대량 구동 시설을 설치하기에 완벽한 장소였습니다.,,"궤도에서는 선형 매스드라이버 궤도의 흔적이 쉽게 눈에 띄지만, 자세히 살펴보면 레고크리트에서 돋아난 뒤틀린 지지 기둥의 행군 선만 남아 있음이 드러납니다. 초전도 코일과 기타 귀중한 하드웨어는 오랫동안 약탈당했습니다. 마찬가지로 핵융합 발전소와 공장의 돔은 얇은 대기로 인해 열려 있고 죽은 서식지 격자의 무질서한 확장은 매 통과하는 메탄 표류로 인해 가려집니다.",,
planet_nortia,CUSTOM,거대 가스 살루스(Salus)의 L4 지점에 갇힌 거대하지만 익명의 금속/규산염 소행성인 노르티아(Nortia)는 한때 계절별 로봇 채광 작업과 약물 남용에 전념하다가 아스코니아 위기(Askonia Crisis) 동안 난민들로 넘쳐났습니다. 이제 그것은 시스템 내에서 가장 강력한 헌장주의 반군의 독립 기반을 형성하고 있습니다.,," 위기 이후 Nortia의 광산 및 정제 센터는 종양이 많은 암석 교외 지역으로 성장했습니다. 여기 지표면 아래의 광산 터널을 따라가면 통신 어레이, 태양열 집열기 및 압력 돔이 솟아오르고 있습니다. 시민 거버넌스는 합법적인 정부를 사칭하는 독립적인 밀수업자들의 지상 카르텔을 지지하는 지하 차터리스트 저항 세력(이중 군사 계층/세포 구조로 조직됨) 간의 불안한 합의의 형태로 수행됩니다. 헤게모니 외교적 존재.",,
planet_druj,CUSTOM,"차별화된 금속 코어를 암시하는 상당한 자기장이 있기는 하지만, 죽고 황량한 세계입니다. Aka Mainyu가 방출한 이온 폭풍은 Druj에 눈부신 고에너지 입자를 쏟아부어 휘발성 물질을 폭파하고 표토에 나노상 철의 어두운 아크를 남깁니다.",,,,
planet_aka_mainyu,CUSTOM, 1차 조석에 고정된 뜨거운 가스 거인 아카 마이뉴(Aka Mainyu)의 낮 쪽은 기화 금속 바람이 시속 수천 킬로미터에 달하는 영원한 지옥 같은 소용돌이입니다. 50만 톤의 이온화된 가스가 매초 대기에서 폭발하여 Duzahk 시스템의 전체 내부 볼륨에 걸쳐 감지 가능한 효과를 갖는 복잡한 소용돌이형 자기꼬리를 생성합니다.,,,,
toxic_cold,PLANET,"에탄과 메탄 구름으로 얼룩진 두꺼운 질소 스모그로 둘러싸인 얼어붙은 세계. 표면은 침식된 얼음, 바람에 휩쓸린 유기 화합물 모래 언덕, 탄화수소 바다로 구성되어 있습니다. 액체 물은 조석 가열과 맨틀 깊은 곳의 방사성 원소 붕괴에 의해 구동되는 극저온 화산에서 메탄으로 거품을 내며 분출합니다.",,,,
slipstream,TERRAIN,고대 지구에서 고대 선원들이 항해했던 해류와 유사한 초공간의 흐름입니다.,,,,
nebula,TERRAIN,"수소, 헬륨, 먼지로 이루어진 성간 구름은 함대가 그 안에 숨어 있는 데 도움이 될 수 있는 상당한 센서 소음을 유발합니다. (상대적으로) 두꺼운 매체도 드라이브 필드 작동을 방해합니다.",,,,
event_horizon,TERRAIN,블랙홀의 사건 지평선 근처의 중력 플럭스는 극단적입니다.,,,,
pulsar_beam,TERRAIN,강렬한 방사선과 결합된 상대론적 자기 제트입니다. 중성자별에서 흔히 방출됩니다.,,,,
corona,TERRAIN,"별을 둘러싸고 있는 고온 플라즈마의 후광. 대부분의 함선은 코로나로 인한 극심한 방사선 충격에 장기간 노출되는 것을 견딜 수 있도록 제작되지 않았으며, 그 안에 남아 있으면 피해를 입을 것입니다.",,,,
corona_aka_mainyu,TERRAIN,고에너지 이온의 폭풍과 유난히 강한 자기 변동. 대부분의 함선은 이러한 극심한 방사선 폭격에 장기간 노출되는 것을 견딜 수 있도록 제작되지 않았으며 함선 내에 남아 있으면 피해를 입습니다.,,,,
asteroid_belt,TERRAIN,소행성이 풍부한 궤도 지역.,,,,
ring,TERRAIN,엄청난 양의 센서 소음을 발생시키는 촘촘한 먼지나 얼음 원반으로 함대가 그 안에 숨어 있는 데 도움이 됩니다. 매체는 함선의 속도를 의미 있게 늦출 만큼 밀도가 충분하지 않습니다.,,,,
debris_field,TERRAIN,"전투, 인양 작업 또는 단순히 중력이 안정된 위치에서 함께 표류한 후에 남겨진 잔해입니다.",,,,
asteroid_field,TERRAIN,소행성이 풍부한 공간.,,,,
magnetic_field,TERRAIN,고에너지 하전 입자를 가두는 강한 자기장. 내부에 숨어 있는 함대에서 센서 판독값을 얻는 것은 극히 어렵습니다.,,,,
hyperspace_normal,TERRAIN,완전히 시공간이 아닌 이 위상학적으로 이국적인 매체는 성간 여행에 대한 유클리드 기하학에 의해 부과된 제약을 회피하기 위해 우주선에 의해 사용됩니다.,,,,
hyperspace_deep,TERRAIN,이 초공간 볼륨은 특히 혼란스럽기 때문에 초공간 보정 장비의 성능도 방해합니다.,,,,
hyperspace_storm,TERRAIN,"이 초공간 볼륨은 격렬하게 변동하는 공명 폭포로 이어지는 혼란스러운 위상 변화를 겪고 있습니다. 소위 ""초공간 폭풍""에 장기간 노출된다는 고대의 무서운 경고가 여러 세대의 스페이서를 통해 전해졌습니다.",,,,
hyperspace_abyssal,TERRAIN,센서가 거의 뚫을 수 없고 구동 필드에 엄청난 압력을 가하는 심연의 초공간입니다. 많은 오래된 스페이서의 이야기의 주제는 부둣가 바의 편안함 속에서 더 쉽게 웃어넘겼습니다.,,,,
stellar_mirror,CUSTOM,태양 에너지를 반사하고 집중시키는 데 사용되는 초경량 궤도 거울 배열입니다. 항성 거울은 일반적인 테라포밍 도구이며 그 사용 기술은 도메인 확장 단계의 황금기 동안 Eridani-Utopia Terraforming 회사에 의해 정점에 이르렀습니다.,,,,
stellar_shade,CUSTOM,태양 에너지를 편향시키고 수집하는 데 사용되는 초경량 궤도 쉐이드 어레이입니다. 항성 색조는 일반적인 테라포밍 도구이며 그 사용 기술은 도메인 확장 단계의 황금기 동안 Eridani-Utopia Terraforming 회사에 의해 정점에 이르렀습니다.,,,,
kite,SHIP,"친숙한 민간 설계인 ""Kite""급 항공 왕복선은 우주 여행 시대에도 귀중한 전문 분야인 항공 공학에 대한 Fabrique Orbitale의 명성을 일상적으로 상기시켜 줍니다. 이 소형 공간/항공기는 효율적인 대기 비행을 위해 간소화되었으며 델타 수준 AI 하위 시스템에 의해 조정된 영리하게 분산된 단거리 기동 추진기 그리드를 자랑하여 원활한 착륙을 보장합니다(Fabrique 마케팅에서 재미있는 애드홀로를 통해 이 지점을 유도함). 잘 차려입은 커플과 가득 담긴 와인잔이 특징입니다). Kite는 같은 크기의 민간 함선에 적합한 강력한 엔진을 갖추고 있지만 특수 하위 시스템이 작동하지 않을 때 무중력 기동성은 바람직하지 않습니다.
 
 붕괴 후 위험한 사이클에서 Kite에는 방어 포탑이 장착되었습니다. 중역급 전망대 대신 두 개의 보조 제트 포드가 미사일 시스템(제한된 동력 장치를 사용할 필요가 없음)으로 교체됩니다. 공정한 싸움에서는 견디지 못하지만, 카이트는 예상치 못한 날카로운 이빨을 갖고 있어 속도를 이용해 침입자들로부터 탈출할 수 있습니다. Luddic Path 급진주의자들은 개조된 연을 사용하여 무력한 화물선에 공격 무기를 전달한 다음 기동 하위 시스템을 사용하여 피해자 호위대의 분노를 피하기 위해 신속하게 탈출하는 것으로 알려져 있습니다.",,,,
gryphon,SHIP,"그리폰(Gryphon)은 중화력 지원을 위한 고도의 기동성 플랫폼을 제공하도록 설계된 전용 미사일 순양함입니다. 최전선 순양함이 아니므로 호위대가 제공될 때 가장 잘 작동합니다.
 
 Altair Exotech가 설계한 소위 ""크루저 학교"" 함선 중 Gryphon은 전력 투사 전략의 핵심 구성 요소였습니다. 게이트 시스템이 붕괴되기 직전에 유행했습니다. 그리폰은 특무부대 사령관이 특화된 중화력을 빠르게 집중하여 돌격급 순양함과 구축함의 모루에 파괴적인 망치를 형성할 수 있도록 고안되었습니다. 어쨌든 도메인 시대의 전술 매뉴얼을 읽어보세요. 전투 중. 이를 통해 그리폰은 집중된 질량을 원하는 무장으로 효과적으로 변환하여 전투 중에 미사일 재고를 보충할 수 있습니다. 물론 이 프로세스의 플럭스 출력은 엄청나기 때문에 방패에 의존하여 적의 공격을 차단하는 선장이 통합 미사일 나노포지 시스템을 사용하는 것은 바람직하지 않습니다.",,,,
hammer,WEAPON,"이 멍청한 로켓은 소행성 채굴자들이 민간에 응용하기 시작한 덕분에 붕괴 이전의 페르세안 섹터 어디에서나 볼 수 있었습니다. 장비가 매우 부족한 사람들이 사용하는 공격용 무기인 해머는 가난한 독립 민병대, 해적, 특히 Luddic Path에서 가장 자주 사용됩니다. 이로 인해 이 무기에 대한 다소 신성모독적인 이름인 ""러드의 망치(Ludd's Hammer)""가 탄생하게 되었습니다.",,,,
hammer_single,WEAPON,"이 멍청한 로켓은 소행성 채굴자들이 개척한 응용으로 인해 붕괴 이전의 페르세안 구역 어디에나 있었습니다. 장비가 매우 부족한 사람들이 사용하는 타격 무기인 해머는 가난한 독립 민병대, 해적, 특히 루딕 패스(Luddic Path)에서 자주 사용됩니다. 이로 인해 이 무기에 대한 다소 신성모독적인 이름인 ""러드의 망치(Ludd's Hammer)""가 탄생하게 되었습니다.",,,,
hammerrack,WEAPON,"이 멍청한 로켓은 소행성 채굴자들이 개척한 응용으로 인해 붕괴 이전의 페르세안 구역 어디에나 있었습니다. 장비가 매우 부족한 사람들이 사용하는 타격 무기인 해머는 가난한 독립 민병대, 해적, 특히 루딕 패스(Luddic Path)에서 자주 사용됩니다. 이로 인해 이 무기에 대한 다소 신성모독적인 이름인 ""러드의 망치""가 탄생하게 되었습니다.
 
 해머 사격 탈것은 수량의 편의를 보여주는 감동적인 예를 제공합니다.",,,,
jackhammer,WEAPON,"이 멍청한 로켓은 소행성 채굴자들이 개척한 응용으로 인해 붕괴 이전의 페르세안 구역 어디에나 있었습니다. 장비가 매우 부족한 사람들이 사용하는 타격 무기인 해머는 가난한 독립 민병대, 해적, 특히 루딕 패스(Luddic Path)에서 자주 사용됩니다. 이로 인해 이 무기에 대한 다소 신성모독적인 대체 이름인 ""Ludd's Hammer""가 탄생했습니다.
 
 이 특정 3발짜리 마운트는 일부 영리한 스페이서가 민간용 랙 사이클러를 차체에 충격을 주는 무기로 수정하는 방법을 알아냈을 때 그 이름을 얻었습니다. 2-3 일제 사격. 수정 사항은 하룻밤 사이에 섹터 전체에 퍼졌습니다.",,,,
