id,type,text1,text2,text3,text4,notes
colossus3,SHIP,"콜로서스(Colossus)는 처음에는 파테르(Pather) 무장세력에 의해 전쟁에 적합하게 개조되었지만, 진취적인 해적들이 곧 그들의 뒤를 따랐습니다. 마찬가지로 무계획적인 과정에서는 대부분의 화물 갑판이 무너지고 다시 용접되어 수많은 무기 배치가 점재하는 두꺼운 갑옷을 형성합니다. 그러나 기본 화물칸은 열려 있었고 전투기 LPC 칩을 수용하기 위해 해킹된 기계 부품을 제조하기 위한 소형 민간 단조 통을 추가하여 대용 전투기 발사대로 전환되었습니다. 단조는 선체의 기본 전력 시스템과 제대로 통합되지 않아 전체 성능이 신뢰할 수 없습니다.
 
 콜로서스 대형 화물선은 아틀라스 초대형 화물선의 잔혹한 경제적 효율성에 압도당하기 전에 도메인 프론티어 공급 함대의 핵심을 형성했습니다. 꼭 필요한 것보다 두꺼운 선체 장갑은 자연과 인간 모두의 우주 위험으로부터 보호합니다.",,,,
warning_beacon,CUSTOM,"완전 자동 경고 신호 장치입니다. 이론적인 작동과 수십만 사이클의 상향 범위로 스테이션 유지 반감기를 가능하게 하는 고체 전력 시스템을 포함합니다.
 
 기민한 우주선 선장은 이 경고에 귀를 기울일 것입니다.",,,,
station_abandoned_mining,CUSTOM,버려진 궤도 채굴 플랫폼인 이 스테이션은 주 표면에서 자원을 효율적으로 추출하는 데 사용되는 스카이훅을 고정하기 위해 건설되었습니다. 부품을 위해 벗겨진 지 오래 된 오래된 산업 모듈과 조용한 거주지 링은 충격과 항성 풍화 작용으로 인해 부식됩니다.,,"작동 중인 주요 스테이션 시스템은 없지만 몇 가지 길잃은 감마 소스와 일부 EM 누출이 있는데, 이는 백업 안전 시스템이 절망적인 작업을 수행하는 것으로 보입니다.",,
planet_gilead,CUSTOM,순례자의 길의 왕관이자 루드(Luddic) 신자들이 소중히 여기는 길르앗은 옛 땅과 맞먹는 낙원이라는 소문이 있습니다. 인류가 모독한 것; 그로부터 인류는 죄 가운데 유배되어 별들 사이에서 고통을 당하게 되었습니다. 그런 세계를 다시 찾을 수 있다는 것은 인류를 구원할 것이라는 약속이다.,,"길르앗의 얼굴은 가장 순수한 비단 구름, 하늘색 바다, 온화하고 구불구불한 황야의 신록 대륙에서 여러분에게 미소를 짓고 있습니다. 이곳의 교회는 엄숙한 정원사처럼 통치하여 인구가 잘 통제되고 러드가 한때 걸었던 땅을 기리는 데 충실하도록 보장합니다.",,
planet_asher,CUSTOM,"Asher는 참회와 노동으로 가득 찬 차갑고 건조한 세계입니다. 길르앗의 중공업 기지 전체가 교회의 루드딕 각성 운동(Luddic Awakening) 기간 동안 이곳으로 이전되었으며, 이는 언제나 실용적이었습니다. 페르세우스 구역의 영적 생활은 우주선 없이는 이루어질 수 없습니다.",,"종말론적인 먼지 폭풍이 잔혹한 하늘을 뒤덮고, 태양을 먼저 피처럼 붉게 물들인 후 따뜻함도 편안함도 제공하지 않는 방향 없는 빛으로 만듭니다. 
 
 광산에서 유출된 면죄액의 필요성은 정제소에서 제조된 다음 궤도에서 조립됩니다. Asher의 근면의 미덕은 아직 교회의 은밀한 수치이며, 특히 영적인 큐레이터들의 설교에서만 우회적으로 언급됩니다.",,
devastator,WEAPON,"본질적으로 속사 능력이 뛰어난 캐피탈 크기의 대공포인 데바스테이터는 광범위한 전투기 LPC 세트를 획득한 반항적인 세계에 대응하여 일반 부품을 사용하여 도메인 아르마다(Domain Armada)에서 개발되었습니다.
 
 세 개의 배럴이 폭발성 발사체를 빠르게 발사합니다. . 빠른 발사 속도로 인해 너무 많은 양의 탄약이 생성되어 근접 탐지기가 다소 신뢰할 수 없게 되어 겉보기에 무작위 범위에서 발사됩니다. 놀라운 현장 결과 이후 오차 범위는 허용 가능한 것으로 간주되었습니다.
 
 데바스테이터의 한 번의 일제사격으로 전투기 날개나 미사일 비행을 제거할 수 있지만, 포탄은 더 크거나 더 먼 목표물에 대해 제한적으로만 사용할 수 있습니다.",,,,
legion,SHIP,"전투모함으로 분류되는 Legion은 인상적인 중화기 배열, 격납고 공간 및 4개의 전투기 날개를 배치하기에 충분한 명령 제어 장치를 탑재하고 있습니다. 최신 모델은 전투기 교체에 초점을 맞춘 나노단조로 업그레이드되어 원거리 배치 시 이빨과 꼬리의 비율을 크게 높였습니다.
 
 Onslaught 설계의 전설적인 성공 이후 초중공업 없이도 반항적인 시스템이 항공모함을 개발할 수 있다는 것이 분명해졌습니다. - 함대의 '노인'에 대응할 수 있는 타격 기반 공격기입니다. 민첩한 대전투 미사일과 고속 추적 지점 방어포 등 새로운 무기와 함께 전략 위원회는 온슬로트와 함께 봉사할 가치가 있는 항공모함을 배치하기로 결정했습니다. 따라서 Legion은 전투선에 서 있는 동안 요격기와 공격기용 플랫폼을 제공하도록 설계되었습니다. 
 
 '크루저 학교' 지지자들은 Legion의 전문성이 부족하다고 비판했으며, 전투 역할이 별개의 함선 선체로 분리되면 유사한 전투기를 더 적은 비용과 더 큰 유연성으로 배치할 수 있다고 주장했습니다. 이러한 경제적 주장은 다가오는 군단이 전투의 핵심 지점에서 압도적인 화력을 전달하기 위해 불타오르는 추진력을 사용하는 앞에서 무뎌집니다.",,,,
ai_cores,RESOURCE,"희귀하고 가치 있는 독립 AI 코어입니다. 이것은 인공 지능의 물리적 영혼이며, 인간의 정신을 뛰어넘는 정교한 사고를 할 수 있는 놀라울 정도로 복잡한 인공물입니다. 두려움, 숭배, 탐욕의 대상입니다. AI의 사용과 규제를 놓고 전쟁이 벌어졌습니다.
 
 AI 코어는 자체적으로 외부 세계에 영향을 미칠 수 없습니다. 그 방대한 능력을 활용하려면 코어를 냉각수 욕조에 담그고 해당 작업에 적합한 대용량 데이터 라인 묶음에 부착해야 합니다. 배치되면 코어에는 완전히 아날로그 충성도 보장 장치를 장착해야 합니다. 일반적으로 이는 기계적 방아쇠를 사용하는 조잡한 화학 폭발물의 형태를 취합니다.",,,,
,,,,,,
survey_data,RESOURCE,"이 TriPad에는 도메인 식민부의 전통적인 지침에 따라 구성된 천체의 경제적, 산업적, 전략적 특성에 대한 정보를 보유한 최근 조사 데이터베이스가 포함되어 있습니다. 이와 같은 조사는 성공적인 군사 작전, 식민지화 노력 및 기업 벤처의 필수 요소입니다.",,,,
survey_data_1,RESOURCE,"이 TriPad에는 도메인 식민부의 전통적인 지침에 따라 구성된 천체의 경제적, 산업적, 전략적 특성에 대한 정보를 보유한 최근 조사 데이터베이스가 포함되어 있습니다. 이와 같은 설문조사는 성공적인 군사 작전, 식민지화 노력 및 기업 벤처의 필수 요소입니다.
 
 여기에 포함된 데이터는 전혀 눈에 띄지 않습니다. 그들이 말했듯이 '그냥 또 다른 바위'입니다.",,,,
survey_data_2,RESOURCE,"이 TriPad에는 도메인 식민부의 전통적인 지침에 따라 구성된 천체의 경제적, 산업적, 전략적 특성에 대한 정보를 보유한 최근 조사 데이터베이스가 포함되어 있습니다. 이와 같은 설문조사는 성공적인 군사 작전, 식민지화 노력 및 기업 벤처의 필수 요소입니다.
 
 여기에 포함된 데이터는 예외가 아닙니다.",,,,
survey_data_3,RESOURCE," 이 TriPad에는 도메인 식민부의 전통적인 지침에 따라 구성된 천체의 경제적, 산업적, 전략적 특성에 대한 정보를 보유한 최근 조사 데이터베이스가 포함되어 있습니다. 이와 같은 조사는 성공적인 군사 작전, 식민지화 노력 및 기업 벤처의 필수 요소입니다.
 
 이 조사 데이터는 인간 착취에 유용한 세계를 설명하며 좋은 가격에 판매될 것입니다.",,,,
survey_data_4,RESOURCE,"이 TriPad에는 도메인 식민부의 전통적인 지침에 따라 구성된 천체의 경제적, 산업적, 전략적 특성에 대한 정보를 보유한 최근 조사 데이터베이스가 포함되어 있습니다. 이와 같은 설문조사는 성공적인 군사 작전, 식민지화 노력 및 기업 벤처의 필수 요소입니다.
 
 이 설문 조사 데이터는 표준 타당성 차트에서 높은 점수를 받은 세계를 설명합니다. 올바른 당사자에게 판매되면 상당한 가치가 있음이 입증될 것입니다.",,,,
survey_data_5,RESOURCE,"이 TriPad에는 도메인 식민부의 전통적인 지침에 따라 구성된 천체의 경제적, 산업적, 전략적 특성에 대한 정보를 보유한 최근 조사 데이터베이스가 포함되어 있습니다. 이와 같은 조사는 성공적인 군사 작전, 식민지화 노력 및 기업 벤처의 필수 요소입니다.
 
 이 데이터는 예외적인 세계를 설명하며 해당 섹터의 모든 주요 세력에 큰 가치가 있을 것입니다.",,,,
planet_ancyra,CUSTOM,"태양풍에 의해 휘발성 물질이 부분적으로 제거된 느린 자기장을 가진 건조하고 오래된 세계입니다. Ancyra가 한때 얕고 따뜻한 바다로 덮여 있었다는 증거가 있습니다. 표백된 소금 모래 언덕, 독특하게 결정화된 실리카로 이루어진 이상한 탑과 능선, 인간 정착민이 도청하고 착취한 염수 대수층 몇 개 등이 있습니다.",,Ancyra의 경제는 헤게모니 물류에 의해 지배됩니다. 경공업 단지는 군사 계약을 기반으로 성장했으며 이제 핵심 헤게모니 공간의 민간 상업 네트워크에 상당한 진출을 할 수 있는 규모와 정당성을 보유하고 있습니다.,,
station_ancyra,CUSTOM," 안키라 기지는 페르세우스 섹터의 도메인 식민지화 초기에 처음 건설된 권위의 보루입니다. 장갑 선체판은 여러 번 수리 및 교체되어 원본이 남아 있는지 확실하지 않습니다. 시설은 특별히 편안하지는 않지만, 쇠퇴한 느낌보다는 엄숙하고 엄숙한 분위기를 자아냅니다.",,"채용 홀로그램은 들어오는 스페이서를 환영합니다 - ""해군에 합류하세요, 섹터를 보세요!"". 벽면 도금의 무광택 패치는 슬로건에 대한 건방진 추가가 이미 유지 관리 드론에 의해 제거되었음을 나타냅니다.",,
station_derinkuyu,CUSTOM,데린쿠유 기지는 붕괴 후 아틀라스급 화물선을 위한 유지보수 갠트리의 상부 구조 위에 건설되었습니다. 이것들은 함께 용접되어 Ancyra의 궤도 밖으로 부양된 다음 갈라티아 소행성대에 안정화되어 채굴 작업의 기지 역할을 했습니다. 최근 집권 헤게모니 대령의 '장거리 행진'과 관련된 공공 질서의 붕괴로 인해 통제권이 느슨하게 조직된 불량 광부 협의회에 넘겨졌습니다.,,환영으로 방문객을 압도했던 역이 결코 없었던 Derinkuyu는 이제 비상 선체 밀봉 판의 새로운 패치워크를 자랑하며 광부와 경무장한 MuniSec 민병대 사이에 의심스러운 표정을 교환하며 외부인을 맞이합니다.,,
station_galatia_academy,CUSTOM,"페르세우스 부문에서 가장 오래되고 권위 있는 독립 대학 기관입니다. Galatia Academy는 핵심 세계의 나머지 대학 중에서 최고의 선택입니다. 교무처장은 동문과의 관계를 활용하고, 가장 똑똑하거나 가장 부유한 학생들의 새로운 세대에 영향을 미치고, 최첨단 연구를 직접 이끌 수 있는 특히 강력한 직위입니다.",,,,
cobra,SHIP,"Cobra 설계는 전투기 섀시에 사신 어뢰 발사기를 장착하려는 추측 프로젝트에서 탄생한 Collapse 이전에 시작되었습니다. 
 
 설계 요구 사항으로 인해 거의 즉시 제어가 중단되었으며 일정 초과로 인해 Cobra 프로젝트가 첫 번째 주기에서 종료되어야 했습니다. 그러나 개척지 탐사와 인양으로 재산을 모은 괴짜 소유자는 자신의 재산을 디자인에 쏟아부었고 프로토타입 개발을 완료하기 위해 특정 범죄 집단으로부터 단기 대출을 확보한 것으로 알려졌습니다. 도메인 해군 조달 위원회(Domain Naval Procurement Board)는 이 제안을 완전히 거부했으며 이는 대자본 뇌격기를 ""억제""하려는 명시되지 않은 정책 때문이라고 제안되었습니다.
 
 개발 책임자는 매우 불쾌한 상황에서 사망한 채 발견되었습니다. 수사관들은 그것을 자살로 판결했습니다. 한편, 합법적인 대출 기관의 유감스럽게도 Cobra의 설계도와 프로토타입 LPC는 허공으로 사라졌습니다.",,,,
perdition,SHIP,"전투 방식으로 개조된 퍼디션(Perdition) 뇌격기는 패터(Pather)와 좀 더 온건한 종파의 루드딕 무장세력이 특히 붕괴 초기에 중포에 대한 만성적인 접근 부족을 해결하기 위해 시도한 것입니다. 일반적인 민간 조사/배달 Cranefly급 유틸리티 셔틀이 기본 섀시 역할을 합니다. 원래 작은 화물 패키지나 적합한 스페이서 몇 개를 운반하도록 설계된 Perdition은 보기 흉한 임시 변통 장갑 껍질에 용접되었으며 화물창 잠금 장치 문은 제거되어 오래된 화물 래치 시스템에 고정된 단일 해머 어뢰를 장착합니다.
 
 큰 믿음 이 무모한 차량을 전투에 투입하려면 생존 가능성 통계가 합리적인 승무원을 단념시켜야 하기 때문입니다.",,,,
station1,SHIP,"중장갑과 적당한 화력을 갖춘 저기술 모델 궤도 정거장입니다. 이 플랫폼에는 조선소, 거주지, 공장, 무기 및 보급품의 대규모 비축량이 포함되어 있어 지역 궤도 전체에 군사 및 산업 전력을 투사할 수 있습니다.",,,,
station1_midline,SHIP,"무거운 측면과 빠른 축 회전을 특징으로 하는 정중선 모델 궤도 관측소입니다. 이 플랫폼에는 조선소, 거주지, 공장, 무기 및 보급품의 대규모 비축량이 포함되어 있어 지역 궤도 전체에 군사 및 산업 전력을 투사할 수 있습니다.",,,,
station1_hightech,SHIP,"강력한 회전 방패, 전투기 보완 장치, 적당한 화력을 갖춘 하이테크 모델 궤도 정거장입니다. 이 플랫폼에는 조선소, 거주지, 공장, 무기 및 보급품의 대규모 비축량이 포함되어 있어 지역 궤도 전체에 군사 및 산업 전력을 투사할 수 있습니다.",,,,
station2,SHIP,"두꺼운 갑옷과 추가로 견고한 요새 및 지점 방어 성채를 갖춘 대규모 저기술 모델 전투 스테이션입니다. 이 플랫폼에는 조선소, 거주지, 공장, 무기 및 보급품의 대규모 비축량이 포함되어 있어 지역 궤도 전체에 군사 및 산업 전력을 투사할 수 있습니다.",,,,
station2_midline,SHIP,"육중한 측면과 빠른 축 회전 외에도 미사일 지원 모듈로 강화된 대형 미드라인 모델 전투 스테이션입니다. 이 플랫폼에는 조선소, 거주지, 공장, 무기 및 보급품의 대규모 비축량이 포함되어 있어 지역 궤도 전체에 군사 및 산업 전력을 투사할 수 있습니다.",,,,
station2_hightech,SHIP,"강력한 방패, 전투기 보완 장치, 방어 성채, 강력한 화력을 갖춘 대규모 첨단 기술 모델 전투 기지입니다. 이 플랫폼에는 조선소, 거주지, 공장, 무기 및 보급품의 대규모 비축량이 포함되어 있어 지역 궤도 전체에 군사 및 산업 전력을 투사할 수 있습니다.",,,,
station3,SHIP,"페르세우스 구역 현대 무중력 건설의 정점이자 메를론급 방어 드론과 광범위한 지뢰밭을 특징으로 하는 저기술 모델로 건설된 거대한 별 요새입니다. 이 플랫폼에는 조선소, 거주지, 공장, 그리고 지역 궤도 전체에 군사 및 산업 전력을 투사할 수 있는 대규모 무기 및 보급품 비축물이 있습니다.",,,,
station3_midline,SHIP,"조선소, 서식지, 공장, 대량의 무기 및 보급품 비축물을 수용할 수 있는 페르시아 구역의 현대 무중력 건설의 정점인 거대한 별 요새입니다. 이 플랫폼은 지역 궤도 전체에 군사 및 산업 전력을 투사합니다.",,,,
station3_hightech,SHIP,"강력한 방패, 강화 장갑, 가고일급 방어 드론, 무시무시한 장거리 지뢰 텔레포터를 갖춘 거대한 하이테크 모형 별 요새입니다. 이 플랫폼은 조선소, 거주지, 공장, 대규모 무기 및 보급품 비축량을 수용할 수 있어 지역 궤도 전체에 군사 및 산업 전력을 투사할 수 있습니다.",,,,
merlon,SHIP,"멀론(Merlon)은 인상적인 지점 방어 무기를 갖춘 중형 기지 방어 드론입니다. 승무원, 여행 드라이브 또는 독립적 명령 AI가 필요하지 않은 Merlon은 비슷한 크기의 함선보다 더 많은 장갑판으로 가득 차 있습니다.",,,,
gargoyle,SHIP,"가고일(Gargoyle)은 첨단 팔라딘 PD 시스템(Paladin PD System)과 자체 방어막 생성기를 갖춘 첨단 기지 방어 드론입니다. 승무원, 이동 드라이브 또는 모든 종류의 독립적인 명령 코어가 필요하지 않기 때문에 가고일은 비슷한 크기의 자유 비행 선체보다 전투에서 더 효과적으로 작동합니다.",,,,
ravelin,SHIP,"Ravelin은 지원 사격 및 지점 방어에 초점을 맞춘 중형 스테이션 방어 드론입니다. 승무원, 이동 드라이브 또는 모든 종류의 독립적인 지휘 코어가 필요하지 않기 때문에 Ravelin은 전투에서 중량급보다 훨씬 높은 펀치를 날릴 수 있습니다.",,,,
prometheus2,SHIP,"광신적인 패더들은 AM 연료인 '인페르늄'을 운반하는 유조선을 거대한 성전의 도구로 전환하면서 아이러니한 정의감을 발견했습니다. 보유 탱크와 적재 포트는 잘게 찢어져 격납고나 총포 마운트로 전환되었으며, 펌핑 장치의 일부는 찢어져 거대한 장갑판으로 교체되었습니다. 주 연료 탱크의 곡선 활은 코어 처리되어 Moloch를 섬기는 이들에게 미사일 포격을 가할 수 있도록 개조되었으며, 아마도 그들이 축복받은 망각 속에서 면죄부를 찾을 수도 있을 것입니다.",,,,
atlas2,SHIP,"아틀라스급 초대형 화물선은 해적 공격의 주요 표적입니다. 나중에 일부 외로운 궤도에 충돌 잔해가 날카롭게 분사되는 부서진 심장에서 몇 개가 발견됩니다. 다른 사람들은 해적의 두 번째 평가를 받고 비밀 조선소로 끌려갑니다. 화물창은 찢어지고, 무기 마운트와 강화된 탄약 공급 라인을 수용하기 위한 트러스로 교체되었습니다.
 
 진공과 불 속에서 다시 태어난 이 아틀라스는 이제 해적 군벌의 손에서 죽음의 화물을 전달합니다.",,,,
generic_probe,CUSTOM,"기본적인 초공간 기능을 갖춘 범용 자동화 프로브입니다. 원격, 위험 또는 매우 지루한 별 시스템에서 데이터 수집을 수행하기 위해 거대 기업 및 연구 기관에서 가장 자주 사용됩니다. 이 모델은 소형 기기 패키지를 포함하도록 제작되었습니다.",,,,
ga_probe,CUSTOM,장거리 센서 판독값은 갈라티아 아카데미 연구 부서에서 사용하는 일반적인 프로브 등급의 사양과 일치합니다.,,,,
ga_hyperprobe,CUSTOM,장거리 센서 판독값은 Galatia Academy Hyperspace Physics Group에서 사용하는 일반적인 프로브 클래스의 사양과 일치합니다. 활성 트랜스폰더의 흔적은 없지만 EM 누출로 인해 하위 시스템이 작동하는 것으로 나타났습니다.,,,,
gaPZ_relay,CUSTOM,장거리 스캔 판독 결과 이 물체는 고정되지 않은 계기 플랫폼의 일반적인 클래스일 가능성이 높습니다. 센서는 손상된 핵 배터리를 나타내는 방사선 누출을 감지합니다. 시끄러운 EM 영상은 보통에서 심각한 구조적 손상을 나타냅니다.,,,,
cargo_pod_special,CUSTOM,고가시성 응답기가 장착된 밝게 도색된 화물 포드입니다.,,,,
minipulser,WEAPON,"""테스트 베드가 파괴됐으니 뭐. 스펙상 자본, 인적 손실을 우리가 책임진다. 중요한 건 결과도 나왔고, 선배 연구원도 잃지 않았다는 거다. 뭐, 새로 설치하는 건 내가 직접 감독할게."" 현장에 도착하면 순양함급 방어막 장비를 준비하겠습니다.""",#NAME?,,,
shockrepeater,WEAPON,"""어쨌든 그것은 방어선과 지원 소함대 사이를 통과했습니다. 늑대가 그것을 제거하기 전에 승무원 수송선에 융합된 센서, 항법 및 생명 지원 장치가 있습니다. 이제 우리는 극한 동결 상태의 볼투르니안 랍스터를 평생 공급하지만 여분은 없습니다. 3세대 에어 사이클러. 이것이 바로 경영진의 우선순위입니다.""",#NAME?,,,
riftlance,WEAPON,"""우리는 창조주께서 영원한 생명의 순환 속에서 우리를 새롭게 하실 수 있도록 이 몸을 거룩한 진공에, 먼지는 먼지로, 별은 별에게 맡깁니다.""",#NAME?,,,
riftbeam,WEAPON,"""다시 켜지 말자.""",#NAME?,,,
cryoflux,WEAPON,"""파면이 붕괴됨에 따라 가시 스펙트럼과 그 너머의 방사선이 방출됩니다. 음, 우리는 그것이 시공간 법칙과의 재조정 때문이라고 생각합니다. 엄청난 거시적 영향을 미치는 효과도 있습니다. 이번 긴급 회의의 주제가 될 것입니다.""",#NAME?,,,
cryoblaster,WEAPON,"""CIC 역에서 바로 캡을 찾았는데, 냉동포드보다 더 차갑습니다. 함선의 절반도 황동으로 되어 있고, 모두 일치하는 절반은 아닙니다.""",#NAME?,,,
disintegrator,WEAPON,"""나는 질량-에너지 등가가 너무 무심코, 너무 광범위하게 위반될 수 있다는 의미에 불안해합니다.""",#NAME?,,,
riftcascade,WEAPON,"""충분합니다. '흑마술'에 대한 또 다른 농담을 하는 사람은 누구나 연구실 파티 기금에 10밀리크레디트를 기부해야 합니다.""",#NAME?,,,
vpdriver,WEAPON,"""방패 장교는 전방 호에서 국부적인 극성 반전을 보고했으며, '초' 내에 완전히 붕괴되는 것으로 추정됩니다.""","- AAR, 이시르에서의 첫 만남, [편집됨] 탐험",,,
realitydisruptor,WEAPON,"""더럽히는 자가 창조주의 날실과 씨실을 풀 때, 그들은 그 별빛 융단 뒤에서 무엇을 발견할 것인가? 무단 침입으로 어두워진 수천 개의 눈.""",#NAME?,,,
amsrm,WEAPON,"""나는 유물에 대한 제한된 접근 권한만 부여했을 때 프로젝트 책임자의 일정에 따라 결과를 제공하라는 요청을 받은 것에 대한 직업적 좌절감을 표현하기 위해 글을 씁니다. 손상 분석만으로는 충분하지 않으며 우리는 해당 데이터 세트에서 가능한 모든 것을 짜냈습니다. 예, 그렇습니다. AM 페이로드입니다. 그러나 전달 시스템 자체는? 우리는 우주가 열사할 때까지 초장 구성, 안정적인 위상 패턴 및 편집증적인 대칭 소멸 이론에 대해 계속 토론할 수 있습니다. 사실은 우리가 할 수 있을 때까지 모두 순수한 추측에 불과하다는 사실이 남아 있습니다. 또 다른 유물을 구해오세요.""",- 트라이타키온 직원 38940855,,,
resonatormrm,WEAPON,"""우리는 유도, 추진, 페이로드 격리... 거의 모든 것에 혼란스러워합니다. 우리가 중입자 물질을 다루고 있는지조차 불분명합니다. 좋은 데이터를 얻을 만큼 오랫동안 표본을 격리할 수 없었을 뿐입니다. """,#NAME?,,,
rifttorpedo,WEAPON,"""나는 인간의 도시와 뼈가 파괴되어 창조주를 찬양할 수 있는 것이 아무것도 남지 않고, 성소를 모실 신전도 남아 있지 않고, 말씀을 기억하기 위해 사는 사람도 없으며, 그러면 거룩한 것은 아무것도 없고 모든 것이 불경스러운 것을 봅니다.""",#NAME?,,,
gigacannon,WEAPON,"""Ultradyne Askonia Combine 이사회의 고위 해군 장교들은 엔지니어링 책임자의 반대에도 불구하고 대규모 AM 프로젝터 무기 개발에 박차를 가했습니다. 프로젝트는 소위 집행자(반역자 Andrada)의 개인적인 요청으로 시작된 것으로 알려졌습니다. HEGINT 자산 보고서 시험 발사 디스플레이 극적인 전력 출력을 제공하지만 무기 시스템 통합은 교리적 비효율성으로 인해 함대 작전에서 적의 전투 능력을 감소시킬 것으로 예상됩니다. 방해 행위 작전을 권장하지 않습니다.""",#NAME?,,,
kineticblaster,WEAPON,"""HEGINT 자산이 제공한 장거리 판독에 따르면 무기 시스템은 SUPER ALABASTER 기술의 요소를 통합하여 이전에 활용되지 않은 방어막 효과를 활용합니다. Opis 이후 고갈된 원시 Askonian 물리학 시설은 그러한 획기적인 발전이 가능한 것으로 간주되지 않습니다. [ref 담당자 HEGINT/ASKON- M38-12]. 결론: 거의 확실하게 신드리안 반란에 대한 TT 기술 지원이 이루어졌습니다.""",#NAME?,,,
